{
  "$schema": "../../../contracts/handoffs/task-result.schema.json",
  "task_id": "V03-001",
  "title": "native-client-first-delivery",
  "milestone": "V0.3",
  "status": "partial",
  "owner": "architecture-coordinator",
  "branch": "codex/v03-001-native-client-first-delivery",
  "worktree": "C:\\YOKI\\Codex\\AssetLibrary-worktrees\\V03-001",
  "commit": "ce454c61fc00a9c75b22f71964a6b6778a9e66e6",
  "changed_files": [
    ".codex/START_HERE.md",
    ".codex/handoffs/V03-001/delivery.json",
    ".codex/handoffs/V03-001/desktop-cleanup-pending.json",
    ".codex/handoffs/V03-001/nas-read-only-smoke.json",
    ".codex/handoffs/V03-001/result.json",
    ".codex/handoffs/V03-001/summary.md",
    ".codex/handoffs/V03-001/tests.md",
    ".codex/handoffs/V03-002/explorer-proof-evidence.json",
    ".codex/handoffs/V03-002/result.json",
    ".codex/handoffs/V03-002/summary.md",
    ".codex/handoffs/V03-002/tests.md",
    ".codex/handoffs/V03-003/android-dependency-audit.json",
    ".codex/handoffs/V03-003/result.json",
    ".codex/handoffs/V03-003/screenshots/phone-detail.png",
    ".codex/handoffs/V03-003/screenshots/phone-font200.png",
    ".codex/handoffs/V03-003/screenshots/phone-real-core.png",
    ".codex/handoffs/V03-003/screenshots/tablet-dark.png",
    ".codex/handoffs/V03-003/summary.md",
    ".codex/handoffs/V03-003/tests.md",
    ".codex/handoffs/V03-004/result.json",
    ".codex/handoffs/V03-004/summary.md",
    ".codex/handoffs/V03-004/tests.md",
    ".codex/project-state.json",
    ".codex/task-graph.json",
    ".codex/task-registry.json",
    ".codex/tasks/V03-001.md",
    ".codex/tasks/V03-002.md",
    ".codex/tasks/V03-003.md",
    ".codex/tasks/V03-004.md",
    ".github/workflows/platform-quality.yml",
    "AGENTS.md",
    "apps/android/.gitignore",
    "apps/android/README.md",
    "apps/android/app/build.gradle.kts",
    "apps/android/app/gradle.lockfile",
    "apps/android/app/src/androidTest/kotlin/app/assetlibrary/android/RealCoreUiTest.kt",
    "apps/android/app/src/androidTest/kotlin/app/assetlibrary/android/WorkspaceUiTest.kt",
    "apps/android/app/src/main/AndroidManifest.xml",
    "apps/android/app/src/main/kotlin/app/assetlibrary/android/MainActivity.kt",
    "apps/android/app/src/main/kotlin/app/assetlibrary/android/protocol/AssetLinkClient.kt",
    "apps/android/app/src/main/kotlin/app/assetlibrary/android/protocol/HttpsTransport.kt",
    "apps/android/app/src/main/kotlin/app/assetlibrary/android/protocol/Models.kt",
    "apps/android/app/src/main/kotlin/app/assetlibrary/android/ui/WorkspaceApp.kt",
    "apps/android/app/src/main/kotlin/app/assetlibrary/android/ui/WorkspaceTheme.kt",
    "apps/android/app/src/main/kotlin/app/assetlibrary/android/workspace/WorkspaceModel.kt",
    "apps/android/app/src/main/res/drawable/ic_library.xml",
    "apps/android/app/src/main/res/values/strings.xml",
    "apps/android/app/src/main/res/values/styles.xml",
    "apps/android/app/src/main/res/xml/data_extraction_rules.xml",
    "apps/android/app/src/test/kotlin/app/assetlibrary/android/protocol/ProtocolTest.kt",
    "apps/android/app/src/test/kotlin/app/assetlibrary/android/workspace/WorkspaceModelTest.kt",
    "apps/android/build.gradle.kts",
    "apps/android/buildscript-gradle.lockfile",
    "apps/android/gradle.properties",
    "apps/android/gradle/verification-metadata.xml",
    "apps/android/gradle/wrapper/gradle-wrapper.jar",
    "apps/android/gradle/wrapper/gradle-wrapper.properties",
    "apps/android/gradlew",
    "apps/android/gradlew.bat",
    "apps/android/settings.gradle.kts",
    "apps/windows-client/AssetLibrary.Windows.slnx",
    "apps/windows-client/Core/AssetLibrary.Windows.Core.csproj",
    "apps/windows-client/Core/ClientModels.cs",
    "apps/windows-client/Core/ClientTransport.cs",
    "apps/windows-client/Core/OriginHttpSession.cs",
    "apps/windows-client/Core/ReadOnlyClient.cs",
    "apps/windows-client/Core/ResponseReader.cs",
    "apps/windows-client/Core/ServerProfile.cs",
    "apps/windows-client/Core/WorkspaceState.cs",
    "apps/windows-client/Core/packages.lock.json",
    "apps/windows-client/README.md",
    "docs/02_已确认需求基线.md",
    "docs/05_总体架构与技术框架.md",
    "docs/16_版本路线与验收门禁.md",
    "docs/18_已砍除与延期清单.md",
    "docs/adr/ADR-0006_独立客户端先于Explorer.md",
    "docs/adr/ADR-0017_原生客户端首版只读工作区.md",
    "docs/adr/ADR-0018_Windows原生Explorer入口与最小视图.md",
    "docs/matrices/CLIENT_CAPABILITY_MATRIX.md",
    "docs/matrices/REQUIREMENTS_TRACEABILITY.csv",
    "docs/matrices/REQUIREMENTS_TRACEABILITY.md",
    "docs/releases/NATIVE_CLIENT_TRIAL.md",
    "eng/README.md",
    "eng/android-dependency-policy.json",
    "packages/ui/README.md",
    "packages/ui/workspace-theme.json",
    "scripts/export_native_theme.py",
    "scripts/validate_android_dependencies.py",
    "scripts/validate_architecture_baseline.py",
    "scripts/validate_dotnet_source.py",
    "scripts/verify_repository.py",
    "tests/architecture/architecture-rules.json",
    "tests/architecture/ci-tiers.json",
    "tests/dotnet/AssetLibrary.WebGateway.Tests/NativeClientConnectionFiles.cs",
    "tests/dotnet/AssetLibrary.WebGateway.Tests/NativeClientFixtureSeed.cs",
    "tests/dotnet/AssetLibrary.WebGateway.Tests/NativeClientIntegrationServerTests.cs",
    "tests/dotnet/AssetLibrary.WebGateway.Tests/NativeClientSampleAssets.cs",
    "tests/dotnet/AssetLibrary.WebGateway.Tests/NativeClientTlsFixtureTests.cs",
    "tests/dotnet/AssetLibrary.WebGateway.Tests/TrialHostIntegrationCertificateContainer.cs",
    "tests/dotnet/AssetLibrary.WebGateway.Tests/TrialHostIntegrationConfiguration.cs",
    "tests/dotnet/AssetLibrary.WebGateway.Tests/TrialHostIntegrationFixture.cs",
    "tests/dotnet/Shared/TrialTestTls.cs",
    "tests/integration/native-clients/README.md",
    "tests/integration/native-clients/serve.py",
    "tests/integration/native-clients/test_serve.py",
    "tests/repository/test_android_dependencies.py",
    "tests/windows-client/AssemblyInfo.cs",
    "tests/windows-client/AssetLibrary.Windows.Tests.csproj",
    "tests/windows-client/CertificateTests.cs",
    "tests/windows-client/LiveCoreTests.cs",
    "tests/windows-client/ProtocolFixture.cs",
    "tests/windows-client/QueryContractTests.cs",
    "tests/windows-client/README.md",
    "tests/windows-client/SessionBoundaryTests.cs",
    "tests/windows-client/TransportTests.cs",
    "tests/windows-client/WorkspaceTests.cs",
    "tests/windows-client/packages.lock.json",
    "tests/windows-shell/CMakeLists.txt",
    "tests/windows-shell/DirectNavigation.cpp",
    "tests/windows-shell/ExplorerProof.cpp",
    "tests/windows-shell/ExplorerProof.def",
    "tests/windows-shell/Probe.cpp",
    "tests/windows-shell/README.md",
    "tests/windows-shell/registration.ps1",
    "tests/windows-shell/verify.ps1"
  ],
  "changed_contracts": [],
  "tests": {
    "passed": 97,
    "failed": 1,
    "skipped": 0,
    "report": "tests.md",
    "scope": "Distinct logical checks; real Explorer entry failed and remaining view/soak gates lack evidence. Integration repository verification is recorded in delivery.json.",
    "execution_status": "scoped_checks_passed_manual_explorer_entry_failed"
  },
  "risks": [
    "No usable Explorer/Windows installer; entry failure before class factory remains unexplained.",
    "Native desktop input is denied; eight owned test windows await reobservation and cleanup.",
    "Android debug trial signing; API36 emulator does not prove HyperOS/Android11 real-device or 500k scale readiness."
  ],
  "blocked_by": [
    "M0-002-G1 real Explorer entry failure",
    "Native desktop input 0x80070005; user confirmation pending",
    "M0-002-G2/G3/G4 lack real-view lifecycle/latency/soak evidence"
  ],
  "recommended_merge_order": 30,
  "handoff_summary": ".codex/handoffs/V03-001/summary.md",
  "thread_deep_link": "",
  "architecture_review": {
    "module": "Native client integration and platform quality",
    "dependency_direction_ok": true,
    "reused_existing_logic": [
      "Generated AssetLink .NET/Kotlin SDKs and existing authenticated read APIs",
      "Existing core permission/path/query semantics; no duplicated domain rules",
      "Web semantic CSS exported for Android themes",
      "Existing real PostgreSQL/TrialHost/Worker fixture"
    ],
    "duplicated_logic": [],
    "cross_module_access": [],
    "new_language_or_framework": [
      "Activated the previously frozen Kotlin2.3/Jetpack Compose Android platform; no unapproved language or second UI framework."
    ],
    "new_major_dependencies": [
      "Approved Kotlin2.3.20/AGP9.1.1/Compose BOM2026.08.00 and AndroidX native adapter dependencies, pinned with strict locks/verification",
      "CI-only android-emulator-runner v2.38.0; Apache-2.0 and SDK-tool replacement path documented"
    ],
    "contract_changes": [
      "ADR-0017 authorizes native single-origin in-memory session adaptation; no wire change",
      "ADR-0018 applies the user-required native Explorer entry without enabling production Shell",
      "Shared generated theme and native platform CI commands"
    ],
    "architecture_tests": [
      "Repository/source/SDK/theme/native dependency gates",
      "35 shared migration/architecture cases",
      "Native unit/real client/UI/fixture and fail-closed runtime audit checks"
    ],
    "technical_debt": [
      "Explorer actual discovery and supported real-view integration must be resolved before production Shell",
      "Android production signing/device/scale and full preview/sync/endpoint-failover remain future scope"
    ]
  }
}
