{
  "$schema": "../../../contracts/handoffs/task-result.schema.json",
  "task_id": "V03-008",
  "title": "web-image-preview",
  "milestone": "V0.3",
  "status": "ready_for_review",
  "owner": "web-gateway-owner",
  "branch": "codex/v03-008-web-image-preview",
  "worktree": "C:\\Users\\Administrator\\.codex\\worktrees\\a25c\\AssetLibrary",
  "commit": "cb4f66e3217a1b23f6426de3d8c6dda061b875e7",
  "changed_files": [
    ".codex/handoffs/V03-008/build-evidence.json",
    ".codex/handoffs/V03-008/implementation-plan.md",
    ".codex/handoffs/V03-008/real-core/.gitattributes",
    ".codex/handoffs/V03-008/real-core/acceptance-index.json",
    ".codex/handoffs/V03-008/real-core/cases-before-interaction.json",
    ".codex/handoffs/V03-008/real-core/forward-cleanup.json",
    ".codex/handoffs/V03-008/real-core/interaction-final.json",
    ".codex/handoffs/V03-008/real-core/real-invisible-identity.png",
    ".codex/handoffs/V03-008/real-core/real-preview-desktop.png",
    ".codex/handoffs/V03-008/real-core/real-preview-mobile-alpha.png",
    ".codex/handoffs/V03-008/real-core/real-preview-mobile-text200.png",
    ".codex/handoffs/V03-008/result.json",
    ".codex/handoffs/V03-008/screenshots/preview-desktop.png",
    ".codex/handoffs/V03-008/screenshots/preview-mobile-dark.png",
    ".codex/handoffs/V03-008/screenshots/preview-mobile-text200.png",
    ".codex/handoffs/V03-008/summary.md",
    ".codex/handoffs/V03-008/tests.md",
    ".codex/tasks/V03-008.md",
    "apps/web/README.md",
    "apps/web/src/assetLinkClient.ts",
    "apps/web/src/assetLinkError.ts",
    "apps/web/src/DerivedImage.tsx",
    "apps/web/src/EntryCollectionPage.tsx",
    "apps/web/src/EntryDetails.tsx",
    "apps/web/src/hooks/useSession.ts",
    "apps/web/src/ImagePreview.tsx",
    "apps/web/src/imageRequests.ts",
    "apps/web/src/imageResponses.ts",
    "apps/web/src/ReadOnlyWorkspace.tsx",
    "apps/web/src/SessionGate.tsx",
    "apps/web/src/styles.css",
    "apps/web/src/styles/images.css",
    "apps/web/src/VirtualEntryList.tsx",
    "apps/web/src/WorkspacePrimitives.tsx",
    "tests/web/assetlink-fixtures.mjs",
    "tests/web/image-fixtures.mjs",
    "tests/web/image-preview.spec.mjs",
    "tests/web/read-only-workspace.spec.mjs",
    "tests/web/real-core-image-input-check.mjs",
    "tests/web/real-core-image-preview.md",
    "tests/web/real-core-image-preview.mjs",
    "tests/web/real-core-image-support.mjs"
  ],
  "changed_contracts": [],
  "tests": {
    "passed": 73,
    "failed": 0,
    "skipped": 0,
    "report": "tests.md",
    "real_core_acceptance": "16 image/error assertions plus separately scoped interaction continuation passed on the same fixture; see SHA-bound acceptance-index.json, not counted as 16 extra unit tests"
  },
  "risks": [
    "No NAS deployment, full V0.3/Explorer or production file-write release claim.",
    "No 500k-asset or long-running total-browser-memory stress evidence; client Blob/pixel bounds are not an RSS measurement.",
    "Real browser evidence is deliberately two-stage: original top-level failed receipt retained and remaining interaction scope resolved by a distinct SHA-bound continuation."
  ],
  "blocked_by": [],
  "recommended_merge_order": 3,
  "handoff_summary": ".codex/handoffs/V03-008/summary.md",
  "thread_deep_link": "codex://threads/01a0808d-7174-7900-a2d6-9ee4ecc89779",
  "architecture_review": {
    "module": "WebGateway UI and AssetLink HTTP adapter; web-gateway-owner",
    "dependency_direction_ok": true,
    "reused_existing_logic": [
      "Existing generated AssetLink envelope, single fetch adapter, same-origin Cookie/CSRF and unchanged JSON deadline",
      "Existing React/TypeScript, TanStack virtualization, paginated queries, workspace history, selection, Modal and semantic CSS",
      "Coordinator image-preview-v1/ADR-0019 consumed without duplicating server permission, source identity or physical-path rules"
    ],
    "duplicated_logic": [],
    "cross_module_access": [
      "Only public AssetLink endpoints; no database, server module internals or original file access"
    ],
    "new_language_or_framework": [],
    "new_major_dependencies": [],
    "contract_changes": [],
    "architecture_tests": [
      "Final format/TypeScript build/Web source/dependency-size gates passed for product77271e0",
      "66 unique browser regressions passed including an initially failing mounted-row keyboard focus regression; no unchanged full-suite rerun",
      "Seven Node runner-input checks passed; explicit real runner excluded from default mock suite",
      "Actual Core874fb6a/worker40d2d69/Web77271e0 TLS/CSP/static hashes, 16 image/error assertions and interaction continuation verified with two original receipt SHA bindings",
      "Root canonical cleanup receipt and local SSH ownership/port cleanup independently read back"
    ],
    "technical_debt": []
  }
}
