{
  "$schema": "../../../contracts/handoffs/task-result.schema.json",
  "task_id": "V01-004",
  "title": "实现 Library/Asset/Scan 只读核心",
  "milestone": "V0.1",
  "status": "ready_for_review",
  "owner": "codex-agent-v01-004",
  "branch": "codex/v01-004-library-asset-scan-read-core",
  "worktree": "C:\\YOKI\\Codex\\worktrees\\V01-004",
  "commit": "",
  "changed_files": [],
  "changed_contracts": [],
  "tests": {
    "passed": 0,
    "failed": 0,
    "skipped": 0,
    "report": "tests.md"
  },
  "risks": [],
  "blocked_by": [],
  "recommended_merge_order": 0,
  "handoff_summary": ".codex/handoffs/V01-004/summary.md",
  "thread_deep_link": "",
  "architecture_review": {
    "module": "",
    "dependency_direction_ok": false,
    "reused_existing_logic": [],
    "duplicated_logic": [],
    "cross_module_access": [],
    "new_language_or_framework": [],
    "new_major_dependencies": [],
    "contract_changes": [],
    "architecture_tests": [],
    "technical_debt": []
  }
}
