{
  "$schema": "../../../contracts/handoffs/task-result.schema.json",
  "task_id": "V03-035",
  "title": "explorer-page-controls",
  "milestone": "V0.3",
  "status": "ready_for_review",
  "owner": "windows-page-controls-owner",
  "branch": "codex/v03-035-explorer-page-controls",
  "worktree": "C:\\YOKI\\Codex\\AssetLibrary-worktrees\\V03-035",
  "commit": "aefa1f49fa9b13334648c47c82ef3b12ddc170bf",
  "changed_files": [
    ".codex/handoffs/V03-035/result.json",
    ".codex/handoffs/V03-035/summary.md",
    ".codex/handoffs/V03-035/tests.md",
    ".codex/tasks/V03-035.md",
    "apps/windows-shell/gallery/Surface.cpp",
    "tests/windows-gallery/SurfaceTests.cpp"
  ],
  "changed_contracts": [],
  "tests": {
    "passed": 12,
    "failed": 0,
    "skipped": 0,
    "report": "tests.md",
    "scope": "12 affected native component CTests,2.25s; unchanged geometry-only test intentionally excluded."
  },
  "risks": [
    "View owns authorization/history/page queries and cross-page preview; actual Explorer/package acceptance remains coordinator-owned.",
    "No GUI/installation/Host/NAS/G4 evidence claimed by this component task."
  ],
  "blocked_by": [],
  "recommended_merge_order": 1,
  "handoff_summary": ".codex/handoffs/V03-035/summary.md",
  "thread_deep_link": "",
  "architecture_review": {
    "module": "Windows gallery Surface native page controls; V03-035 owner",
    "dependency_direction_ok": true,
    "reused_existing_logic": [
      "Frozen ADR0025/Surface.h SetPageNavigation and pageStep; only boolean presentation and±1 output.",
      "Existing Win32 BUTTON/font/theme/wrapping/Tab and UIA/MSAA native accessibility.",
      "Existing OwnedState/owner lifetime, page/preview retirement and selection/rendering/budget behavior."
    ],
    "duplicated_logic": [],
    "cross_module_access": [],
    "new_language_or_framework": [],
    "new_major_dependencies": [],
    "contract_changes": [],
    "architecture_tests": [
      "Strict MSVC /W4 /WX /analyze /utf-8 /MT build passed.",
      "12 affected CTests passed: flags, native accessibility, nine-entry Tab, narrow layout and callback/enable/focus reentry;original preview/rendering/budget/retirement preserved.",
      "verify_repository passed:539 governed inputs,21 migration model tests,14 architecture tests and dependency/SDK/theme checks;Alpha stays blocked."
    ],
    "technical_debt": []
  }
}
